{
  "schema_version": "0.2.0",
  "kind": "dry_run_plan",
  "id": "dry_run_resolved_basic_odmr_mock",
  "resolved_recipe_id": "resolved_basic_odmr_mock",
  "summary": {
    "step_count": 201,
    "estimated_duration_s": 201.0,
    "required_devices": [
      "smb100a_01"
    ],
    "hazard_actions": 0
  },
  "steps": [
    {
      "step_id": "step_000001",
      "sweep_coordinate": {
        "smb100a.rf.frequency_hz": 2820000000.0
      },
      "device_actions": [
        "smb100a_01: set_rf_frequency"
      ],
      "estimated_duration_ms": 1000
    },
    {
      "step_id": "step_000002",
      "sweep_coordinate": {
        "smb100a.rf.frequency_hz": 2820500000.0
      },
      "device_actions": [
        "smb100a_01: set_rf_frequency"
      ],
      "estimated_duration_ms": 1000
    },
    {
      "step_id": "step_000003",
      "sweep_coordinate": {
        "smb100a.rf.frequency_hz": 2821000000.0
      },
      "device_actions": [
        "smb100a_01: set_rf_frequency"
      ],
      "estimated_duration_ms": 1000
    },
    {
      "step_id": "step_000004",
      "sweep_coordinate": {
        "smb100a.rf.frequency_hz": 2821500000.0
      },
      "device_actions": [
        "smb100a_01: set_rf_frequency"
      ],
      "estimated_duration_ms": 1000
    },
    {
      "step_id": "step_000005",
      "sweep_coordinate": {
        "smb100a.rf.frequency_hz": 2822000000.0
      },
      "device_actions": [
        "smb100a_01: set_rf_frequency"
      ],
      "estimated_duration_ms": 1000
    },
    {
      "step_id": "step_000006",
      "sweep_coordinate": {
        "smb100a.rf.frequency_hz": 2822500000.0
      },
      "device_actions": [
        "smb100a_01: set_rf_frequency"
      ],
      "estimated_duration_ms": 1000
    },
    {
      "step_id": "step_000007",
      "sweep_coordinate": {
        "smb100a.rf.frequency_hz": 2823000000.0
      },
      "device_actions": [
        "smb100a_01: set_rf_frequency"
      ],
      "estimated_duration_ms": 1000
    },
    {
      "step_id": "step_000008",
      "sweep_coordinate": {
        "smb100a.rf.frequency_hz": 2823500000.0
      },
      "device_actions": [
        "smb100a_01: set_rf_frequency"
      ],
      "estimated_duration_ms": 1000
    },
    {
      "step_id": "step_000009",
      "sweep_coordinate": {
        "smb100a.rf.frequency_hz": 2824000000.0
      },
      "device_actions": [
        "smb100a_01: set_rf_frequency"
      ],
      "estimated_duration_ms": 1000
    },
    {
      "step_id": "step_000010",
      "sweep_coordinate": {
        "smb100a.rf.frequency_hz": 2824500000.0
      },
      "device_actions": [
        "smb100a_01: set_rf_frequency"
      ],
      "estimated_duration_ms": 1000
    },
    {
      "step_id": "step_000011",
      "sweep_coordinate": {
        "smb100a.rf.frequency_hz": 2825000000.0
      },
      "device_actions": [
        "smb100a_01: set_rf_frequency"
      ],
      "estimated_duration_ms": 1000
    },
    {
      "step_id": "step_000012",
      "sweep_coordinate": {
        "smb100a.rf.frequency_hz": 2825500000.0
      },
      "device_actions": [
        "smb100a_01: set_rf_frequency"
      ],
      "estimated_duration_ms": 1000
    },
    {
      "step_id": "step_000013",
      "sweep_coordinate": {
        "smb100a.rf.frequency_hz": 2826000000.0
      },
      "device_actions": [
        "smb100a_01: set_rf_frequency"
      ],
      "estimated_duration_ms": 1000
    },
    {
      "step_id": "step_000014",
      "sweep_coordinate": {
        "smb100a.rf.frequency_hz": 2826500000.0
      },
      "device_actions": [
        "smb100a_01: set_rf_frequency"
      ],
      "estimated_duration_ms": 1000
    },
    {
      "step_id": "step_000015",
      "sweep_coordinate": {
        "smb100a.rf.frequency_hz": 2827000000.0
      },
      "device_actions": [
        "smb100a_01: set_rf_frequency"
      ],
      "estimated_duration_ms": 1000
    },
    {
      "step_id": "step_000016",
      "sweep_coordinate": {
        "smb100a.rf.frequency_hz": 2827500000.0
      },
      "device_actions": [
        "smb100a_01: set_rf_frequency"
      ],
      "estimated_duration_ms": 1000
    },
    {
      "step_id": "step_000017",
      "sweep_coordinate": {
        "smb100a.rf.frequency_hz": 2828000000.0
      },
      "device_actions": [
        "smb100a_01: set_rf_frequency"
      ],
      "estimated_duration_ms": 1000
    },
    {
      "step_id": "step_000018",
      "sweep_coordinate": {
        "smb100a.rf.frequency_hz": 2828500000.0
      },
      "device_actions": [
        "smb100a_01: set_rf_frequency"
      ],
      "estimated_duration_ms": 1000
    },
    {
      "step_id": "step_000019",
      "sweep_coordinate": {
        "smb100a.rf.frequency_hz": 2829000000.0
      },
      "device_actions": [
        "smb100a_01: set_rf_frequency"
      ],
      "estimated_duration_ms": 1000
    },
    {
      "step_id": "step_000020",
      "sweep_coordinate": {
        "smb100a.rf.frequency_hz": 2829500000.0
      },
      "device_actions": [
        "smb100a_01: set_rf_frequency"
      ],
      "estimated_duration_ms": 1000
    },
    {
      "step_id": "step_000021",
      "sweep_coordinate": {
        "smb100a.rf.frequency_hz": 2830000000.0
      },
      "device_actions": [
        "smb100a_01: set_rf_frequency"
      ],
      "estimated_duration_ms": 1000
    },
    {
      "step_id": "step_000022",
      "sweep_coordinate": {
        "smb100a.rf.frequency_hz": 2830500000.0
      },
      "device_actions": [
        "smb100a_01: set_rf_frequency"
      ],
      "estimated_duration_ms": 1000
    },
    {
      "step_id": "step_000023",
      "sweep_coordinate": {
        "smb100a.rf.frequency_hz": 2831000000.0
      },
      "device_actions": [
        "smb100a_01: set_rf_frequency"
      ],
      "estimated_duration_ms": 1000
    },
    {
      "step_id": "step_000024",
      "sweep_coordinate": {
        "smb100a.rf.frequency_hz": 2831500000.0
      },
      "device_actions": [
        "smb100a_01: set_rf_frequency"
      ],
      "estimated_duration_ms": 1000
    },
    {
      "step_id": "step_000025",
      "sweep_coordinate": {
        "smb100a.rf.frequency_hz": 2832000000.0
      },
      "device_actions": [
        "smb100a_01: set_rf_frequency"
      ],
      "estimated_duration_ms": 1000
    },
    {
      "step_id": "step_000026",
      "sweep_coordinate": {
        "smb100a.rf.frequency_hz": 2832500000.0
      },
      "device_actions": [
        "smb100a_01: set_rf_frequency"
      ],
      "estimated_duration_ms": 1000
    },
    {
      "step_id": "step_000027",
      "sweep_coordinate": {
        "smb100a.rf.frequency_hz": 2833000000.0
      },
      "device_actions": [
        "smb100a_01: set_rf_frequency"
      ],
      "estimated_duration_ms": 1000
    },
    {
      "step_id": "step_000028",
      "sweep_coordinate": {
        "smb100a.rf.frequency_hz": 2833500000.0
      },
      "device_actions": [
        "smb100a_01: set_rf_frequency"
      ],
      "estimated_duration_ms": 1000
    },
    {
      "step_id": "step_000029",
      "sweep_coordinate": {
        "smb100a.rf.frequency_hz": 2834000000.0
      },
      "device_actions": [
        "smb100a_01: set_rf_frequency"
      ],
      "estimated_duration_ms": 1000
    },
    {
      "step_id": "step_000030",
      "sweep_coordinate": {
        "smb100a.rf.frequency_hz": 2834500000.0
      },
      "device_actions": [
        "smb100a_01: set_rf_frequency"
      ],
      "estimated_duration_ms": 1000
    },
    {
      "step_id": "step_000031",
      "sweep_coordinate": {
        "smb100a.rf.frequency_hz": 2835000000.0
      },
      "device_actions": [
        "smb100a_01: set_rf_frequency"
      ],
      "estimated_duration_ms": 1000
    },
    {
      "step_id": "step_000032",
      "sweep_coordinate": {
        "smb100a.rf.frequency_hz": 2835500000.0
      },
      "device_actions": [
        "smb100a_01: set_rf_frequency"
      ],
      "estimated_duration_ms": 1000
    },
    {
      "step_id": "step_000033",
      "sweep_coordinate": {
        "smb100a.rf.frequency_hz": 2836000000.0
      },
      "device_actions": [
        "smb100a_01: set_rf_frequency"
      ],
      "estimated_duration_ms": 1000
    },
    {
      "step_id": "step_000034",
      "sweep_coordinate": {
        "smb100a.rf.frequency_hz": 2836500000.0
      },
      "device_actions": [
        "smb100a_01: set_rf_frequency"
      ],
      "estimated_duration_ms": 1000
    },
    {
      "step_id": "step_000035",
      "sweep_coordinate": {
        "smb100a.rf.frequency_hz": 2837000000.0
      },
      "device_actions": [
        "smb100a_01: set_rf_frequency"
      ],
      "estimated_duration_ms": 1000
    },
    {
      "step_id": "step_000036",
      "sweep_coordinate": {
        "smb100a.rf.frequency_hz": 2837500000.0
      },
      "device_actions": [
        "smb100a_01: set_rf_frequency"
      ],
      "estimated_duration_ms": 1000
    },
    {
      "step_id": "step_000037",
      "sweep_coordinate": {
        "smb100a.rf.frequency_hz": 2838000000.0
      },
      "device_actions": [
        "smb100a_01: set_rf_frequency"
      ],
      "estimated_duration_ms": 1000
    },
    {
      "step_id": "step_000038",
      "sweep_coordinate": {
        "smb100a.rf.frequency_hz": 2838500000.0
      },
      "device_actions": [
        "smb100a_01: set_rf_frequency"
      ],
      "estimated_duration_ms": 1000
    },
    {
      "step_id": "step_000039",
      "sweep_coordinate": {
        "smb100a.rf.frequency_hz": 2839000000.0
      },
      "device_actions": [
        "smb100a_01: set_rf_frequency"
      ],
      "estimated_duration_ms": 1000
    },
    {
      "step_id": "step_000040",
      "sweep_coordinate": {
        "smb100a.rf.frequency_hz": 2839500000.0
      },
      "device_actions": [
        "smb100a_01: set_rf_frequency"
      ],
      "estimated_duration_ms": 1000
    },
    {
      "step_id": "step_000041",
      "sweep_coordinate": {